{
  "as_of": "2026-09-14T13:00:00Z",
  "captures": [
    {
      "body_path": "blobs/tenant_e4ec08bbc0b73c79ef568f57e9d1026483099a298455b34a7ef0b0971e322a7a/d7/d7dfe7decb437ca705e915c53b9f18edb772fa6d6e9868f1f9f5d0c32fde4013",
      "body_sha256": "d7dfe7decb437ca705e915c53b9f18edb772fa6d6e9868f1f9f5d0c32fde4013",
      "capture_id": "capture_19c95102155aac6c08b8cf3df0ec968a39b1254db8c40410315394d6121903be",
      "complete": true,
      "headers": {
        "content-type": "text/html; charset=utf-8",
        "server": "demo"
      },
      "limitations": [],
      "mode": "RAW_HTML",
      "observed_at": "2026-09-14T12:00:00Z",
      "run_id": "demo-capture-1",
      "source_id": "source:synthetic-fixture",
      "source_ttl_seconds": 2592000,
      "status_code": 200,
      "subject_id": "account:demo",
      "tenant_id": "demo",
      "url": "https://demo.example.test/"
    },
    {
      "body_path": "blobs/tenant_e4ec08bbc0b73c79ef568f57e9d1026483099a298455b34a7ef0b0971e322a7a/9b/9b14bd6068e24a671c840bd8b81439c568f87093741a25d093aceac9f6b908c3",
      "body_sha256": "9b14bd6068e24a671c840bd8b81439c568f87093741a25d093aceac9f6b908c3",
      "capture_id": "capture_5436851cbfbe09c3c53b7238fc28f5d9ff685f25ea2baa875a128b9b229b7a0e",
      "complete": true,
      "headers": {
        "content-type": "application/xml"
      },
      "limitations": [],
      "mode": "RAW_HTML",
      "observed_at": "2026-09-14T12:00:00Z",
      "run_id": "demo-capture-1",
      "source_id": "source:synthetic-fixture",
      "source_ttl_seconds": 2592000,
      "status_code": 200,
      "subject_id": "account:demo",
      "tenant_id": "demo",
      "url": "https://demo.example.test/sitemap.xml"
    },
    {
      "body_path": "blobs/tenant_e4ec08bbc0b73c79ef568f57e9d1026483099a298455b34a7ef0b0971e322a7a/e3/e3ebaa16dd9d9b9fc107c42183fb6cf9d22927e1af03dbbdfa0ccc38e4e4ac31",
      "body_sha256": "e3ebaa16dd9d9b9fc107c42183fb6cf9d22927e1af03dbbdfa0ccc38e4e4ac31",
      "capture_id": "capture_7b9a89fc3bcf73d23610ba2ecdc92e8385ead53264257403274ebc969b33c50a",
      "complete": true,
      "headers": {
        "content-type": "text/plain"
      },
      "limitations": [],
      "mode": "RAW_HTML",
      "observed_at": "2026-09-14T12:00:00Z",
      "run_id": "demo-capture-1",
      "source_id": "source:synthetic-fixture",
      "source_ttl_seconds": 2592000,
      "status_code": 404,
      "subject_id": "account:demo",
      "tenant_id": "demo",
      "url": "https://demo.example.test/fallback"
    },
    {
      "body_path": "blobs/tenant_e4ec08bbc0b73c79ef568f57e9d1026483099a298455b34a7ef0b0971e322a7a/d2/d25d974a9995af0bc7b75f10506fed27bdc629f73740e4c30c6079ec763869f0",
      "body_sha256": "d25d974a9995af0bc7b75f10506fed27bdc629f73740e4c30c6079ec763869f0",
      "capture_id": "capture_881ad2c316b61a5f55b231f377b8b0351c454d511cab4b2e6ccee7210b46262b",
      "complete": true,
      "headers": {
        "content-type": "text/html"
      },
      "limitations": [],
      "mode": "RAW_HTML",
      "observed_at": "2026-09-14T12:00:00Z",
      "run_id": "demo-capture-1",
      "source_id": "source:synthetic-fixture",
      "source_ttl_seconds": 2592000,
      "status_code": 200,
      "subject_id": "account:demo",
      "tenant_id": "demo",
      "url": "https://demo.example.test/contact"
    },
    {
      "body_path": "blobs/tenant_e4ec08bbc0b73c79ef568f57e9d1026483099a298455b34a7ef0b0971e322a7a/14/1468c2bef35f2faaa2672937974a175875aa9c45fac298cc2603fd0d709004fb",
      "body_sha256": "1468c2bef35f2faaa2672937974a175875aa9c45fac298cc2603fd0d709004fb",
      "capture_id": "capture_e38a8a26d5d071f1d218a2b77575632b612116a81e8aa54eacdaebd2cde481c0",
      "complete": true,
      "headers": {
        "content-type": "text/plain"
      },
      "limitations": [],
      "mode": "RAW_HTML",
      "observed_at": "2026-09-14T12:00:00Z",
      "run_id": "demo-capture-1",
      "source_id": "source:synthetic-fixture",
      "source_ttl_seconds": 2592000,
      "status_code": 200,
      "subject_id": "account:demo",
      "tenant_id": "demo",
      "url": "https://demo.example.test/robots.txt"
    }
  ],
  "claims": [
    {
      "capture_count": 2,
      "claim_key": "claim_a448f16c82b8fd991b81ce0d9af3e89e2107f726b1496abec2e982a19db67c44",
      "confidence": null,
      "confidence_policy": "NOT_COMBINED",
      "eligible_match_ids": [
        "match_29d5d38a5b7d91dbefefaca5b49dc24225289d5cf98a924fc0f1bbf9da095ab8",
        "match_54d59aa6f7352a9a2c586de54bf5d14de16f364b7ffaa15a63a12590758f9e7b",
        "match_6d2692f553307df8105ed7ddf12d0e7f01d21c4709377725b0619c3871412db1",
        "match_7fba88f022e3e759e6bf5a5b8ff0176b26a3d91548d5422b0f7a3279050aeb64",
        "match_bdc42a8e155afcc9487b485dc432829a7707cc37cea7f44dec653b76010bf37a"
      ],
      "evidence_count": 3,
      "object_value": true,
      "observation_ids": [
        "observation_1b61942bb59a8122b1f09032199c8f065d377e9e1d7156b56e9c1959b8427b15",
        "observation_557aba412cc53cf4994038672cc43c4de754ff8b03a0ba6ece4dc1a06e572270"
      ],
      "predicate": "vendor.present",
      "rule_ids": [
        "calendly-iframe",
        "calendly-script-candidate",
        "calendly-script-exact",
        "calendly-script-suffix"
      ],
      "source_group_count": 1,
      "status": "SUPPORTED",
      "supporting_match_ids": [
        "match_28cefa965b9f2aec60f65ea4d0a9baacfe5e9fea3bf5a1b3add0429f2cd1074a",
        "match_29d5d38a5b7d91dbefefaca5b49dc24225289d5cf98a924fc0f1bbf9da095ab8",
        "match_54d59aa6f7352a9a2c586de54bf5d14de16f364b7ffaa15a63a12590758f9e7b",
        "match_6d2692f553307df8105ed7ddf12d0e7f01d21c4709377725b0619c3871412db1",
        "match_7fba88f022e3e759e6bf5a5b8ff0176b26a3d91548d5422b0f7a3279050aeb64",
        "match_8302786f3699b6a8b0370ed94b6646e84352c089fd1bab47f20aadd18dd2ec6d",
        "match_bdc42a8e155afcc9487b485dc432829a7707cc37cea7f44dec653b76010bf37a"
      ],
      "target": {
        "product_id": "product:calendly"
      }
    }
  ],
  "commands": [
    {
      "command_id": "CATALOG_LOAD",
      "details": {
        "mode": "REPLAY",
        "release_digest": "release_ac1b18410583af42064839f63c4e0f8d86faf48dd7d26210d4ba8c3001787845"
      },
      "input_ids": [],
      "limitations": [],
      "output_ids": [],
      "status": "COMPLETE"
    },
    {
      "command_id": "EXTRACT_RAW_HTML",
      "details": {
        "original_body_sha256": "d7dfe7decb437ca705e915c53b9f18edb772fa6d6e9868f1f9f5d0c32fde4013",
        "surface_count": 1
      },
      "input_ids": [
        "capture_19c95102155aac6c08b8cf3df0ec968a39b1254db8c40410315394d6121903be"
      ],
      "limitations": [],
      "output_ids": [
        "surface_78b391274a13aadc8ca024214ab1ba873250beeec29abd1fdd5771ca76a0ce90"
      ],
      "status": "COMPLETE"
    },
    {
      "command_id": "EXTRACT_SCRIPT_SRC",
      "details": {
        "surface_count": 1
      },
      "input_ids": [
        "capture_19c95102155aac6c08b8cf3df0ec968a39b1254db8c40410315394d6121903be"
      ],
      "limitations": [],
      "output_ids": [
        "surface_e159b8da9d55a0f5a3fc39f299ada29bcdf2118698af5a0e31eca069f0876ad1"
      ],
      "status": "COMPLETE"
    },
    {
      "command_id": "EXTRACT_SCRIPT_INLINE",
      "details": {
        "surface_count": 1
      },
      "input_ids": [
        "capture_19c95102155aac6c08b8cf3df0ec968a39b1254db8c40410315394d6121903be"
      ],
      "limitations": [],
      "output_ids": [
        "surface_b711cde29e0c515367961e3e49b32ccc801113106791ca84a3bb60064c3633b8"
      ],
      "status": "COMPLETE"
    },
    {
      "command_id": "EXTRACT_IFRAME_SRC",
      "details": {
        "surface_count": 1
      },
      "input_ids": [
        "capture_19c95102155aac6c08b8cf3df0ec968a39b1254db8c40410315394d6121903be"
      ],
      "limitations": [],
      "output_ids": [
        "surface_d9fe85b05f9e83be6da1f77ca9221a96094e05d7d087b4a1a854da43bef5658e"
      ],
      "status": "COMPLETE"
    },
    {
      "command_id": "EXTRACT_FORM_ACTION",
      "details": {
        "surface_count": 1
      },
      "input_ids": [
        "capture_19c95102155aac6c08b8cf3df0ec968a39b1254db8c40410315394d6121903be"
      ],
      "limitations": [],
      "output_ids": [
        "surface_31ab1aba953dbb4cc2262e33f31f608a963a9aace552dcb648daab09feb40d7f"
      ],
      "status": "COMPLETE"
    },
    {
      "command_id": "EXTRACT_ANCHORS",
      "details": {
        "surface_count": 4
      },
      "input_ids": [
        "capture_19c95102155aac6c08b8cf3df0ec968a39b1254db8c40410315394d6121903be"
      ],
      "limitations": [],
      "output_ids": [
        "surface_4e3c2a1622d8f7e8159f77232ccb3c6ce8e55dd3c2f4eb92ab090d25e0cfd072",
        "surface_e84697c28447ba0ba96f8bcae7393d4bac5b01211f95659a0b8b6bb1deed5bfa",
        "surface_5dea7740416201ece9c52a851c5285b9fba5b2facc48c871dbfbcab4d0f1e735",
        "surface_0d673078982ae81e9b252a54e6f8de545cbd4d9ef3a0fb53038982a2ec9a4a0d"
      ],
      "status": "COMPLETE"
    },
    {
      "command_id": "EXTRACT_IMAGES",
      "details": {
        "surface_count": 1
      },
      "input_ids": [
        "capture_19c95102155aac6c08b8cf3df0ec968a39b1254db8c40410315394d6121903be"
      ],
      "limitations": [],
      "output_ids": [
        "surface_434656e78a938c6abbdbe4e0edcd2762c072c98d29ba5a1ec562755a91a66d17"
      ],
      "status": "COMPLETE"
    },
    {
      "command_id": "EXTRACT_LINKS_META",
      "details": {
        "surface_count": 3
      },
      "input_ids": [
        "capture_19c95102155aac6c08b8cf3df0ec968a39b1254db8c40410315394d6121903be"
      ],
      "limitations": [],
      "output_ids": [
        "surface_f75f34b579053392b396f7f0de560dc0568bff4035d70e69bb56f8492a337e63",
        "surface_d6b4b7b0858c78c900e5428b5fb285a4f33df780a7ecf723decd709596def38d",
        "surface_a7cb23a6eeec5d1a57975b1fa9347159371cac131076b1a8bbf78a11cb6f4cc7"
      ],
      "status": "COMPLETE"
    },
    {
      "command_id": "EXTRACT_JSONLD",